{"$schema":"https://json-schema.org/draft/2020-12/schema","type":"object","additionalProperties":false,"required":["schema_version","name","cases"],
 "properties":{"schema_version":{"const":1},"name":{"type":"string","pattern":"^[a-z][a-z0-9-]{1,62}$"},
  "cases":{"type":"array","minItems":1,"maxItems":32,"uniqueItems":true,"items":{"type":"string","pattern":"^[a-z][a-z0-9-]{2,40}$"}},
  "checks":{"type":"array","maxItems":32,"items":{"type":"object","additionalProperties":false,"required":["name","module","before_run"],
   "properties":{"name":{"type":"string","pattern":"^[a-z][a-z0-9-]{2,40}$"},"module":{"type":"string","pattern":"^[a-z_][a-z0-9_.]{0,80}$"},"before_run":{"type":"boolean"},
    "selectors":{"type":"array","minItems":1,"maxItems":8,"uniqueItems":true,"items":{"type":"string","pattern":"^[a-z0-9-]{1,16}$"},
     "description":"Task A2 (PB-02, PC-01): the case selectors that the calls of this check evaluate; bench check arms the covering call deadline from them."}}}},
  "protocol":{"type":"object","additionalProperties":false,"required":["file","sha256"],
   "description":"FR3 (design Task 32): the binding of the project's protected protocol file (schemas/bench-protocol.json). bench_model refuses a protocol directory without this binding and a protocol file whose sha256 differs.",
   "properties":{"file":{"const":"protocol/protocol.json"},"sha256":{"type":"string","pattern":"^[0-9a-f]{64}$"}}},
  "native":{"type":"object","additionalProperties":false,"required":["kernel","agreement"],
   "description":"Phase 2 Task 19 (FR6 N4): the project native declaration. kernel: the program of the native kernel trials (a declared program of project.json) and its argument template; each argument is a literal or one of the placeholders {input}, {records}, {loops}, {threads}, {output}, and {input}, {records}, {loops} and {output} each appear once. agreement: the declared check that bench run runs with the native build before any timing of a case with a C row.",
   "properties":{"kernel":{"type":"object","additionalProperties":false,"required":["program","args"],
     "properties":{"program":{"type":"string","pattern":"^[a-z][a-z0-9_-]{0,62}$"},
      "args":{"type":"array","minItems":4,"maxItems":24,"items":{"type":"string","pattern":"^(?:[A-Za-z0-9._=-]{1,64}|\\{(?:input|records|loops|threads|output)\\})$"}}}},
    "agreement":{"type":"string","pattern":"^[a-z][a-z0-9-]{2,40}$"}}},
  "unit_groups":{"type":"array","minItems":2,"maxItems":8,"items":{"type":"array","minItems":1,"maxItems":64,"uniqueItems":true,"items":{"type":"string","pattern":"^test_[a-z0-9_]{1,60}$"}},
   "description":"Ruling A6-C3 (Task A6 lock follow-up): a fixed partition of the project's python/tests/test_*.py modules; bench selftest --suite unit runs one container command per group. Every module is in exactly one group (bench_model.unit_groups)."}}}
